[
  {
    "strategyId": "stg_001",
    "runsTotal": 4,
    "runsCompleted": 3,
    "runsFailed": 0,
    "runsInProgress": 1,
    "lastRunAt": "2026-09-21T06:20:00Z",
    "bestReturnPercent": 0.5,
    "worstReturnPercent": 0.21,
    "winRateMinPercent": 50,
    "winRateMaxPercent": 75,
    "worstDrawdownPercent": -0.18,
    "bestNetPnl": {
      "runId": "run_001",
      "netPnlPaise": 499474
    },
    "byVersion": [
      {
        "version": 1,
        "runsCompleted": 2,
        "bestReturnPercent": 0.5,
        "bestRunId": "run_001"
      },
      {
        "version": 2,
        "runsCompleted": 1,
        "bestReturnPercent": 0.46,
        "bestRunId": "run_002"
      }
    ]
  },
  {
    "strategyId": "stg_002",
    "runsTotal": 1,
    "runsCompleted": 0,
    "runsFailed": 0,
    "runsInProgress": 1,
    "lastRunAt": "2026-09-21T06:15:00Z",
    "bestReturnPercent": null,
    "worstReturnPercent": null,
    "winRateMinPercent": null,
    "winRateMaxPercent": null,
    "worstDrawdownPercent": null,
    "bestNetPnl": null,
    "byVersion": [
      {
        "version": 1,
        "runsCompleted": 0,
        "bestReturnPercent": null,
        "bestRunId": null
      }
    ]
  },
  {
    "strategyId": "stg_003",
    "runsTotal": 1,
    "runsCompleted": 0,
    "runsFailed": 1,
    "runsInProgress": 0,
    "lastRunAt": "2026-05-02T05:00:00Z",
    "bestReturnPercent": null,
    "worstReturnPercent": null,
    "winRateMinPercent": null,
    "winRateMaxPercent": null,
    "worstDrawdownPercent": null,
    "bestNetPnl": null,
    "byVersion": [
      {
        "version": 1,
        "runsCompleted": 0,
        "bestReturnPercent": null,
        "bestRunId": null
      }
    ]
  }
]
